,decade,text
723,2007,Runaway Love and it go a little this Runaway love runaway love Runaway love runaway love Now little only nine old to figure out why the world is so cold Why all alone and they never met her family always gone and she never met her daddy Part of her is and listen on high up in the kitchen home men at different of the night with some in a fight in her room when her out to have his way and little ouch She to resist but then all he is beat her to tell her but her don't believe her stuck up in a world on her own to think that hell is a place home else to do but get some and pack She to run away and never come back Runaway love runaway love Runaway love runaway love Little is only ten old steady to figure why the world is so cold Why not pretty and nobody to like her Alcoholic always strike her and her with some ask up on the on the out only one girl what about Her name is little and they become Promise that they'll always be tight the end Until one day shot A bullet went stray up on her block Now stuck up in a world on her own to think that hell is a place home else to do but get her and pack She to run away and NEVER come back Runaway love runaway love Runaway love runaway love Little is eleven old steady to figure why the world is so cold So she X to get rid of all the pain Plus sex with her boy sixteen run deep as she in love So no no glove Never the of her for today and not satisfaction The go by and her belly big The father he ain't ready for a kid her would blow it all out of proportion Plus she poor so no money for is stuck up in a world on her own to think that hell is a place home else to do but get her and pack She she to run away and NEVER come Runaway love runaway love Runaway love runaway love runaway love Don't keep away runaway Run run run run Don't keep away don't keep away I know how you been there I was away too I will run away with I will run away with you runaway love Don't keep away run away with if you want me to I can only imagine what you through I feel like away myself So do me a right now and close your And picture us away together When we come back everything be okay Open your
724,2007,Listen up this is it The beat that is delicious make the go They want my so they get their from my photo You can see you can squeeze me I ain't I ain't sleazy I got why I tease just come and go like I ain't promiscuous And if you was suspicious All that is fictitious I blow That them on rock And they be down the block Just to watch what I got so delicious so delicious so delicious make them go crazy They always claim they know me to call me the F to the the the E And can't no other lady put it down like me My body stay vicious I be up in the just on my my witness I put your boy on rock And he be down the block Just to watch what I got so delicious so delicious so delicious Check it baby If you play get some Maybe then you'll get a taste Of my tasty be with so tasty It'll make you crazy T to the A to the you tasty T to the A to the you tasty D to the E to the To the to the E to the To to All the time I turn gather Always at me up and at my I just say it I ain't to up Drama little I don't take your man And I know off just a little bit And I keep on how the eat it But that I can't be like clientele they say she delicious I ain't promiscuous And if you was suspicious All that is fictitious I blow That them on rock And they be down the block Just to watch what I got My body stay vicious I be up in the just on my my witness I put your boy on rock And he be down the block Just to watch what I got so delicious so delicious so delicious so delicious so delicious so delicious T to the A to the you tasty T to the A to the you tasty T to the A to the you tasty T to the A to to to to the To the D to the E to the To the D to the E to the To the D to the E to the To the D to the E to to to to the T to the A to the you tasty T to the A to the you tasty T to the A to the you tasty T to the A to to to to the To the D to the E to the To the D to the E to the To the D to the E to the To the D to the E to to to to
725,2007,We'll do it all Everything On our own We don't need Anything or anyone If I lay here If I just lay here Would you lie with me and just forget the I don't quite know How to say How I feel Those three Are said too much They're not enough If I lay here If I just lay here Would you lie with me and just forget the Forget what we're told Before we get too old Show me a garden into life waste time Around our I need your grace To me To find my own If I lay here If I just lay here Would you lie with me and just forget the Forget what we're told Before we get too old Show me a garden into life All that I am All that I was Is here in your perfect they're all I can see I don't know where about as well Just know that these will never change for us at all If I lay here If I just lay here Would you lie with me and just forget the
726,2007,My Love Ain't another woman that can take your If I wrote you a symphony Just to say how much you mean to me If I told you you were beautiful Would you date me on the been around the world But I ain't seen myself another girl This ring here my heart But just one thing I need from you Because I can see us on the our in the sand I can see us on the country side on the side by side You can be my baby Let me make you my you amaze me Ain't do crazy all I want you to do is be my love My love My love Ain't another woman that could take your spot My love My love My love Ain't another woman that could take your my love my my love Now If I wrote you a love note And made you smile at every word I wrote Would that make you change your scene And be the one on my the point in never been more sure This ring here my heart And everything that you been for Because I can see us on the our in the sand I can see us on the country side on the side by side You can be my baby Let me make you my you amaze me Ain't do crazy all I want you to do is be my love My love My love Ain't another woman that could take your spot My love My love My love Ain't another woman that could take your my love my my love time to get I don't know what you man cool as a on the move once again But he still has from to I don't ruin your plan But if you got a try to lose him if you can the worldwide throw they up high When they come and kick it with a guy You don't let the chance go by you ain't been seen with a man so fly with so I can go fly I handle my They call me Candle Guy Simply I am on fire I hate to have to cancel my so you can't deny but I ain't try You don't I ain't die Hold what you You can't Me and your we ain't no tie You say you kick it when I ain't so high obvious that I ain't guy I ain't fill your space But forget your I swear I will anywhere I chill Just bring with me a I will I can see us on the our in the sand I can see us on the country side on the side by side You can be my baby Let me make you my you amaze me Ain't do crazy all I want you to do is be my love My love My love Ain't another woman that could take your spot My love My love My love Ain't another woman that could take your my love my my
727,2007,Not Ready to Make Nice good not sure I could They say time everything But still through with doubt left for me to figure out paid a price And keep not ready to make nice not ready to back down still mad as hell and I don't have time To go and and too late to make it right I wouldn't if I could mad as can't bring myself To do what it is you think I should I know you've said you just get over It my whole world around And I like it I made my bed and I sleep like a baby With no and I don't mind a sad story when a mother will teach her Daughter that she ought to hate a perfect And how in the world can the that I said Send somebody so over the edge That they'd write me a that I Shut up and sing or my life will be over not ready to make nice not ready to back down still mad as hell and I don't have time To go and and too late to make it right I wouldn't if I could mad as can't bring myself To do what it is you think I should not ready to make nice not ready to back down still mad as hell and I don't have time To go and and too late to make it right I wouldn't if I could mad as can't bring myself To do what it is you think I should What it is you think I should good not sure I could They say time everything But still
728,2007,Welcome to the Black Parade When I was a young my father Took me into the city to see a band He when you grow would you be The of the the and the He you defeat your And all the the that they have Because one leave you a phantom To lead you in the summer to join the black When I was a young my father Took me into the city to see a band He when you grow would you be The of the the and the I get the over me And other I feel like I should go And through it the rise and the in the And when you're we want you all to know We'll carry we'll carry on And though you're dead and believe me Your memory will carry we'll carry on And in my I can't contain it The anthem won't explain it A world that you from Your misery and hate will kill us all So paint it black and take it and shout it loud and clear Defiant to the we hear the call To carry we'll carry on And though you're dead and believe me Your memory will carry we'll carry on And though you're broken and Your weary widow On and we carry through the of your Take a look at I could not care at all Do or you'll never make me Because the world will never take my heart Go and you'll never break me We want it we play this part I won't explain or say sorry show my scar And give a cheer for all the broken Listen because who we are Just a not a hero Just a boy who had to sing this song Just a not a hero I don't care We'll carry we'll carry on And though you're dead and believe me Your memory will carry you'll carry on And though you're broken and Your weary widow on Do or you'll never make me Because the world will never take my heart Go and you'll never break me We want it we play this part Do or you'll never make me Because the world will never take my heart Go and you'll never break me We want it we play this part
729,2007,sexy back Them other don't know how to act I think behind your So turn around and pick up the slack Take it to the Dirty babe You see these your slave let you whip me if I just that no one me feel this way Take it to the chorus Come girl Come to the back on me Let me see what you're with Look at those You make me smile Go child get your sexy on Get your sexy on Get your sexy on Get your sexy on Get your sexy ha Get your sexy on Get your sexy on Get your sexy on sexy back Them other don't know how to act let me make up for the you lack you're I get it fast Take it to the ha Dirty babe You see these your slave let you whip me if I just that no one me feel this way Take it to the ha Come girl Come to the back on me Let me see what you're with Look at those You make me smile Go child get your sexy on Get your sexy on Get your sexy on Get your sexy on Get your sexy ha Get your sexy on Get your sexy on Get your sexy ha You You You sexy back You watch how I attack If your watch your back she'll burn it up for and a fact Take it to the ha Come girl Come to the back on me Let me see what you're with Look at those You make me smile Go child get your sexy on Get your sexy on Get your sexy on Get your sexy on Get your sexy ha Get your sexy on Get your sexy on Get your sexy on You You
730,2007,It Tonight Your they strangle me I can't explain myself at all And all the and all the All I don't want to need at all The start my Maybe best you leave me alone A weight is on this I give the final blow When to light It it tonight A at least I fall alone I can't explain what you can't explain You're that you didn't know I look at you with such disdain The start my Maybe best you leave me alone A weight is on this I give the final blow When to light It it tonight Just a little insight won't make this right too late to it tonight It tonight Now on my own side than being on your side my fault when you're blind that I see it through your All these inside Now you're the first to know When to light It it tonight Just a little insight won't make this right too late to it tonight It when to light It it tonight Just a little insight won't make this right too late to it tonight It tonight insight When to light It
731,2007,Wind it Up High on the hill with the He back with the girl and Wind it up Wind it up Wind it up This is the key that us wind up When the beat the all line up And the all but they can't touch But the want to know why like us so much They like way we they like the way we work They like the way that is my shirt They like the way my it my shape They like the way we every time we hear Every time the bass it your name Let the beat wind you and don't stop your time is up Wind it up Wind it up Wind it up You've got to let the beat get under your skin You've got to open up and let it all in But once it the Then you find out why all the stare they're to bite our style to study our approach They like the way we do so original I guess that they are so they should leave the room This beat is for the and that go Every time the bass it your name Let the beat wind you and don't stop your time is up Wind it up Wind it up Wind it up Wind it up This is your moment Come on you know you own it you know your key is still But you know they're Get get get girl Get get get girl To the to the to the but don't let him ride Keep your night Don't let him steal your light I know he you're fine and stuff But he know how to wind you Wind it up Wind it up Wind it up Wind it up
732,2007,of an Angel why you me so hard to talk right now why you Is everything I whisper I can't be too loud my in the next room I wish she was you I guess we never on good to hear your voice my it so sweet from the of an angel those it me weak And I never say goodbye But you make it hard to be faithful With the of an angel funny that you're me tonight And dreamt of you too he know you're to me Will it start a I don't think she has a clue my in the next room I wish she was you I guess we never on good to hear your voice my it so sweet from the of an angel those it me weak And I never say goodbye But you make it hard to be faithful With the of an angel good to hear your voice my it so sweet from the of an angel those it me weak And I never say goodbye But you make it hard to be faithful With the of an angel But you make it hard to be faithful With the of an angel why you me so
733,2007,Like Mine L B Dub know what this is Only thing that me up when down I don't know about but I keep around I done I done and hard to find Another like mine to how we kick everything you say to me Never knew it could be so that you stay with me Search around the world but you will never find Another like mine like mine I tell my that you got a girl but she ain't nothing like mine Cute face nice size like mine Stay hood with like mine Mean talk the let me tell you some more I knew that when I ran into this one She would be the of my Knew she would be the one to make me stop about other on my jock and them She was the one to slow me hold me down I roll with her know Go with it grow with it now go get how I got her Don't be mad you can't get one Broke the mold when they made I don't care what my say She been there every day for my drama Some of the hate they want her Wish they the my woman get a good look she fine And I don't mind she mine Only thing that me up when down I don't know about but I keep around I done I done and hard to find Another like mine to how we kick everything you say to me Never knew it could be so that you stay with me Search around the world but you will never find Another like like mine I tell my that you got a girl but she ain't nothing like mine Cute face nice size like mine Stay hood with like mine Mean talk the help me tell Now I got all this love inside of me and all I do is give it to her I don't care what the say about it I got something to say about it What about to say is straight up Real no cut I don't play about it There ain't a price you can put on a girl Who just what to say when you need to hear it the most And tell you something else If I don't know nothing I know Only thing that me when down I don't know about but I keep around I done I done and hard to find Another like mine to how we kick everything you say to me Never knew it could be so that you stay with me Search around the world but you will never find Another like mine like mine I tell my that you got a girl but she ain't nothing like mine Cute face nice size like mine Stay hood with like mine Mean talk the let me tell you some more I give her the world And I ain't even lose her to my girl And the way that she in that little skirt Just for me in the in the in the She for L B She a nice size with the pretty brown bright a with the right prize give it to her to the rhythm of a She got a beautiful mind you can't buy that And the sight of her behind when she walk on by Make a try that She got the smile and she Keep me from wild and I thank her And we can talk about she got good conversation My my friend and plus she patient Only thing that me up when down I don't know about but I keep around I done I done and hard to find Another like mine to how we kick everything you say to me Never knew it could be so that you stay with me You can search around the world but you will never find Another like mine like mine I tell my that you got a girl but she ain't nothing like mine Cute face nice size like mine Stay hood with like mine Mean talk the help me tell Only thing that me when down I don't know about you but I keep around I done I done and hard to find Another like mine to how we kick everything you say to me Never knew it could be so that you stay with
734,2007,Far Away This this place Too too late Who was I to make you Just one just one breath Just in case just one left you know You you know I love you I you all along And I miss you Been far away for far too long I keep you'll be with me And you'll never go Stop If I don't see you On my ask Last chance for one last dance with withstand All of Hell to hold your hand give it give for us Give but I won't give up you know You you know I love you I you all along And I miss you Been far away for far too long I keep you'll be with me And you'll never go Stop If I don't see you So far away Been far away for far too long So far away Been far away for far too long But you know You you know I I you to stay I I need to hear you say That I love you I you all along And I forgive you For being away for far too long So keep not you Believe it Hold on to and never let me go Keep not you Believe it Hold on to never let me go Keep Hold on to never let me go Keep Hold on to never let me
735,2007,White They see me my front lawn I know they're all so white and Think just too white and Think just too white and Can't you see white and Look at white and I roll with the But so far they all think too white and Think just too white and Think just too white and just too white and white and First in my class here at Got a champion at my Keep your just have an Earl Grey tea My never to the contrary You'll find that they're quite stationary All of my are cherry in my library My page is all out Got people for my Top I know pi to a thousand Ain't got no but I still wear I order all of my with mayonnaise a whiz at could play for Once you see my sweet you're stay My so fast set the place ablaze no I haven't run At one Do vector calculus just for fun I ain't got a but I got a gun is my theme song I could sure kick your butt in a game of ping pong ace any trivia quiz you bring on fluent in as well as the part I sing on They see me roll on my I know in my heart they think white and Think just too white and Think just too white and Can't you see white and Look at white and like to roll with the Although apparent too white and Think just too white and Think just too white and just too white and I get so white and been you know I collect The in my I must protect My keyboard never me for on some media I edit I Grail well I can it right now and have you I got a business When my need some who do they I do for all Even made a for my I got myself a pack They were a sale down at The Gap Spend my with a roll of bubble wrap hope no one in the extreme and than sour cream I was in Club and Glee Club and even the Chess Team Only question I thought was hard Was do I like Kirk or do I like Spend every weekend at the Renaissance Fair Got my name on my They see me they And their so white and Just because white and Just because white and All because white and white and I bowl with the oh obvious white and Think just too white and Think just too white and just too white and Look at white and
736,2007,Money Shake your money like bout to pay I see you on my don't you act like you're afraid of You know I got If you come get it Stand next to this money like Shake your money like bout to pay Don't worry about them keep your nose up in the air You know I got If you come get it Stand next to this money like shake your money Like you were it for some paper It took your to make Might as well shake what your gave you good in them I bet you'd look even with me in between I keep my mind on my money money on my mind But a hell of a when you shake your behind I got up on my right side some My whole hood is to my left and they ain't a So feel free to get loose and get away So by tomorrow you forgot what you were today But don't forget about this that I am you get And all the you burn from me you sweat The you earn when we my jet And how everywhere you turn be you wet cause you can Shake your money like bout to pay I see you on my don't you act like you're afraid of You know I got If you come get it Stand next to this money like Shake your money like bout to pay Don't worry about them keep your nose up in the air You know I got If you come get it Stand next to this money like switch it from right to left And switch it till you right out of breath And take a break until you ready again And you can invite over as many as You want to but I want you Just be thankful that gave you something to bump to hey at the top of my game You want my from your bottom to the top of your frame And I just take a little ride on your And get erotic your body just what it and Let me give you some on the penis stroke of a genius call me the renaissance man get up and I stay then a man Hey just a bedroom gangster And been to tell that I must thank when you Shake your money like bout to pay I see you on my don't you act like you're afraid of You know I got If you come get it Stand next to this money like Shake your money like bout to pay Don't worry about them keep your nose up in the air You know I got If you come get it Stand next to this money like rock rock Rock rock it an make it girl Please don't stop it until it girl You you been a little tipsy So if you could just shake it a little this way See a member of the The original of You the of attention that is the squad Cause everybody in the campus like OH MY GOD she can Shake your money like bout to pay I see you on my don't you act like you're afraid of You know I got If you come get it Stand next to this money like Shake your money like bout to pay Don't worry about them keep your nose up in the air You know I got If you come get it Stand next to this money like
737,2007,What The Most I can take the rain on the roof of this empty house That me I can take a few now and then and just let them out not afraid to cry every once in a while Even though on with you gone still me There are every now and again I okay But not what me What the most Was being so close And so much to say And you walk away And never What been And not that love in you Is what I was to do hard to deal with the pain of you everywhere I go But It hard to force that smile when I see our old and alone Still with this regret But I know if I could do it over I would give away all the that I in my heart That I left What the most Is being so close And so much to say much to say And you walk away And never What been And not seeing that love in you Is what I was to oh What the most Was being so close And so much to say And you walk away And never What could have been And not seeing that love in you Is what I was to oh Not seeing that love in you what I was to
