,decade,text
832,2005,She Will Be Beauty queen of only eighteen She had some trouble with herself He was always there to help her She always to someone else I drove for and And wound up at your door had you so many But I want more I don't mind every day Out on your in the rain Look for the girl with the broken smile Ask her if she to stay a while And she will be And she will be Tap on my knock on my I Want to make you feel beautiful I know I tend to get so insecure Doesn't not always and compromise that us yeah My heart is full and my always open You come any time you yeah I don't mind every day Out on your in the rain Look for the girl with the broken smile Ask her if she to stay a while And she will be And she will be And she will be And she will be I know where you hide Alone in your car Know all of the that make you who you are I know that goodbye nothing at all back and me catch her Every time she yeah Tap on my knock on my I Want to make you feel beautiful I don't mind every day Out on your in the oh Look for the girl with the broken smile Ask her if she to stay a while And she will be And she will be And she will be And she will be Please don't try so hard to say goodbye Please don't try so hard to say goodbye Please don't try so hard to say
833,2005,Drop It Like Hot When the in the ma it like hot Drop it like drop it like When the try to get at it like hot Park it like park it like And if a get a attitude it like hot Pop it like pop it like I got the on my and And I roll the best weed I got it on a nice with some nice See these ice See these Ice Eligible million dollar boat than down your throat The exterior like fish The interior like red I can exercise this can be your Cheat on your how you get with the I know in the street With the steel that'll make you feel like Chinchilla in the heat So don't try to run up on my ear all that ask me When my fill your they ain't pass me You should think about a second you should take B And think before you with Skateboard P When the in the ma it like hot Drop it like drop it like When the try to get at it like hot Park it like park it like And if a get a attitude it like hot Pop it like pop it like I got the on my and And I roll the best weed I got it on a but knew that Big Boss I had to do that I keep a blue flag out my backside But only on the left the side Ain't no other way to play the game the way I play I cut so you thought I was a double double G I can't fake just break and when I take it I in all the get naked So bring your all of come inside We got a world premiere right now get So don't change the turn it up a little I got a room full of fine dime on the the and the G's to the here we When the in the ma it like hot Drop it like drop it like When the try to get at it like hot Park it like park it like And if a get a attitude it like hot Pop it like pop it like I got the on my and And I roll the best weed I got it on a bad with a lot of Drive my own and wear my own I hang out a real boss Big Snoop yeah so sharp On the and in the If you play me you're on a red beam Oh you got a so you pop stop Cement now on the move Your now you on the They can't find and now they miss you Must I only here to twist you dip then flip you Then dance to this music we to get your issue come let me see how you get When the in the ma it like hot Drop it like drop it like When the try to get at it like hot Park it like park it like And if a get a attitude it like hot Pop it like pop it like I got the on my and And I roll the best weed I got it on
834,2005,Usher Yeah once again on You know we had to do it again yeah guess let me at check me get it how you Hope that you're fine Want to know what you got in mind and I Got me like girl I can't leave you alone A shot of this here and be on done got way too about to end up it a night She should at your tell her that you're the scene beep shotgun in the with me She ready to beep shotgun in the with me She ready to beep shotgun in the with me She to Yeah once you get you can't change your mind Don't mean to sound impatient but you promise oh me again That we'll be me again That we'll be a good look look here Sometime be your sometime be your friend Sometime hug you Hold slow dance while the up your heart you said I made you feel so to play back then now you all grown up like I could play back then now you all grown up like I could play back then now you all grown up like I could be your you could beat me up Play fight in the dark then we both make up I anything just to feel butt Why got me so I don't know but you stop Be a good now turn around and get these You know you like it like that Don't have to fight a bite that And be separate all these separate your can go they separate me again That we'll be me again That we'll be and been you for a long time never my mind But tonight I seen something in you That made me get with you You ain't been nothing but a friend to me And a never we'd be Up in here in the bathtub you sure you go this route Let a know before I pull it out would never cross the line let me hear you tell me one more time One more time me again we'll be me again That we'll be and yeah Please tell your and That and had to do it again please tell your and That and had to do it again please tell your and That and had to do it again Embed
835,2005,Soldier you got the around They'll know it when they see you around the top the and your than the chrome at the white leather inside When them be at tell even try To shoot it with and kick it with or at B be you way your league We like them that be in them Open their their grill Candy keep that whip clean and They always be that country slang we like They keep that beat that be in the back be so low from their I love how he keep my body A rude boy good to street If his status ain't hood I ain't for him be street if he at me I need a soldier That ain't to stand up for me Known to carry big If you know what I mean If his status ain't hood I ain't for him be street if he at me I need a soldier That ain't to stand up for me know to get dough And he be street We like them up top from the Know how to flip that money three Always big on the freeway that east coast slang that us country we like with the deep So quick to snatch up your Always our way us that country the kind of they like If his status ain't hood I ain't for him be street if he at me I need a soldier That ain't to stand up for me Known to carry big If you know what I mean If his status ain't hood I ain't for him be street if he at me I need a soldier That ain't to stand up for me know to get dough And he be street I know some in here Where they Where they They take care of me I know some in here Where they Where they Don't mind one for me I know some in here Where they Where they They spend that on me I know some in here Where they Where they Wouldn't mind that on me Next to the keep a toy in the trunk of the A to run into Still a go to war if you your trap About my ain't no thing to put under the map Walk the with less than a stack And on my chest a special in my plus the dough from the white a reason the king I know what you If his status ain't hood I ain't for him be street if he at me I need a soldier That ain't to stand up for me Known to carry big If you know what I mean If his status ain't hood I ain't for him be street if he at me I need a soldier That ain't to stand up for me know to get dough And he be street I like them over they strong tonight Just might give one the phone tonight in the in my zone tonight He don't know it might be on tonight he good and he right He the type that might change my life Every time he look at my be like That one may be the one tonight If his status ain't hood I ain't for him be street if he at me I need a soldier That ain't to stand up for me Known to carry big If you know what I mean If his status ain't hood I ain't for him be street if he at me I need a soldier That ain't to stand up for me know to get dough And he be street Cash Money is a army with purple on me You to the sergeant Body up like the in call him please say baby If you don't see me on the I ain't to hide I blend in the so join my troop Now every time she hear my she I know some in here Where they Where they They take care of me I know some in here Where they Where they Don't mind one for me I know some in here Where they Where they They spend that on me I know some in here Where they Where they Wouldn't mind that on me
836,2005,Bring Em Out Bring bring Bring bring hard to yell when the in your mouth Bring bring out Bring bring out Bring bring out live from the Heard the lost life without me Both the and the state see bout me The whole city got he got three That other got a but he not me Who set the city on fire as soon as he got The King back don't even know how to act now Hit the naked I sat down Still money stack than now Still push a button to let the roof on the down on the my mack down to to I got the crowd all my hot all the dope from the they Once what other rap than I got and still on some hooligan You be was the You and I was the If I hit you in the you be and And if I catch another case I know truly be so Keep a cool stay out of the And show these other bedtime clear to see that ahead of my time I a to shine I got some it ain't I get with time Who got a flow and a live show than I got a house all my hot all the dope from the they You beef with the What is Will you show up on the scene with two Or you and your friend and play a little If you knew half of what I then you'd be the deck I got a tool and a can get some respect make it hard for a to flex Show this ain't the squad for a to test my too and we way too fresh Work well with and And quick to check a lame like a game of chess You Bring your best we be in your front yard all my hot all the dope from the they We in your front yard all my all the dope from the back they in the air in the air in the in the air Put in the air in the air in the in the air I can't hear Grand I can't hear Bring bring out I can't hear Bring bring out I can't hear You just heard the Of the King of the I go by the name of the Monster I need to this and play this from the We on fire Come That
837,2005,Over and Over all in my head I think about it over and over again And I can't keep you with him And it so yeah all in my head I think about it over and over again I it over and over again And I can't take I can't shake it no I can't wait to see you see if you still got that look in your eye That one you had for me said our And a shame that we spend our time mad about the same Over and over again about the same thing Over and over again but I I don't know what else to do I can't go on not you all in my head I think about it over and over again And I can't keep you with him And it so yeah all in my head I think about it over and over again I it over and over again and I can't take I can't shake it no I the day you left I the last breath you took right in front of me When you said that you would leave I was too damn stubborn to try to stop you or say anything But I see now And this choice I made in my head Over and over again play in my head Over and over again I I don't know what else to do I can't go on not you all in my head I think about it over and over again And I can't keep you with him And it so yeah all in my head I think about it over and over again I it over and over again And I can't take and I can't shake it no that That down From all this pain you've put me through I close my I lock it I can't go on not you all in my head I think about it over and over again And I can't keep you with him And it so yeah all in my head I think about it over and over again I it over and over again And I can't take no I can't shake it no over and over over and over again all in my
838,2005,My my my Not my I got a sick reputation for All I need is me a few or more And a wrap Tell valet to bring my And I ain't back So you can put a car right there the truth And I ain't got to prove And you can ask anybody they seen me do it I run right through to Throw all the dirt you to it You still won't have a in a fabulous room On her out of fruit I love boo love you You know how I do it You may look at me and think that just a young girl But not just a young girl this is what for type his dough not being too dramatic the way I have it I bet you want the Bet you thought about it Got you all hot and Mad I talk around it If you're for the Keep on they stay in the jar yeah Just because you drive a not home with you You won't get no or the no rookie If you ain't independent I ain't it So you already know not too dramatic the way I have it You may talk slick but not dumb not too dramatic just how I have it I bet you want the Bet you thought about it Got you all hot and Mad I talk around it If you're for the Keep on they stay in the jar yeah So damn but so young You ain't got milk on tongue Slow down one And you ain't got it all Hey you don't play the game You think you but you ain't bad show you what bad is Bad is when you're of the been at it since I came to this planet I ain't quite there but at it of fact tell it to you one All I got to do is tell a girl who I am Ain't chick in here that I can't have bam bam bam You're that hot But these are not Just for any of the many men get on top you can't call me later And I don't want your not Just respect the play I bet you want the Bet you thought about it Got you all hot and Mad I talk around it If you're for the Keep on they stay in the jar yeah I bet you want the Bet you thought about it Got you all hot and Mad I talk around it If you're for the Keep on they stay in the jar yeah
839,2005,My Boo always that one person that will always have your heart You never see it you're from the start Know that you're that one for clear for everyone to see yeah You will always be my boo I don't know but I know about us the only way we know how to rock I don't know but I know about us the only way we know how to rock Do you I was the one who gave you your first kiss I girl I was the one who your like Even before all the fame And people your name I was there when you were my baby It when we were you were mine Now another taken but still in your Even though we to I know we haven't seen each other in a while But you will always be my boo I was in love with you when we were you were mine And I see it from time to I still feel like And I can see it no how I try to hide And even though another man in my life You will always be my boo I boy we I could only think about your I boy The moment I knew you were the one I could spend my life with Even before all the and people your name I was there And you were my baby It when we were you were mine Now another taken but still in your Even though we to I know we haven't seen each other in a while But you will always be my boo I was in love with you when we were you were mine And I see it from time to I still feel like And I can see it no how I try to hide And even though another man in my life You will always be my my my my boo My my my my my boo It when we were you were mine Now another taken but still in your Even though we to I know we haven't seen each other in a while But you will always be my boo I don't know about but I know about us the only way we know how to rock I don't know about but I know about us the only way we know how to rock It when we were My
840,2005,Lose My Breath Hit Can you keep Baby make me lose my breath Bring the make me lose my breath Hit me make me lose my Can you keep Baby make me lose my breath Bring the make me lose my breath Hit me make me lose my breath I put it right made it easy for you to get to you act like don't know what to do I had done everything that you me grind you so baby now I can't find you to believe that way too much for you All that but it like it can't come through All them like you could satisfy me Now I see where you got me Gave you the but you can't drive me Can you keep Baby make me lose my breath Bring the make me lose my breath Hit me make me lose my Can you keep Baby make me lose my breath Bring the make me lose my breath Hit me make me lose my breath two I don't like when I to get my groove Is a partner that me only halfway and just can't prove Take me out so deep where you know you can't swim Need a lifeguard and I need To put it on me deep in the right you the that to give to You're so slow like you just don't have a clue Didn't teach you to give I know the from a man and a adolescent It ain't so get to Can you keep Baby make me lose my breath Bring the make me lose my breath Hit me make me lose my Can you keep Baby make me lose my breath Bring the make me lose my breath Hit me make me lose my breath Can you keep Baby make me lose my breath Bring the make me lose my breath Hit me make me lose my Can you keep Baby make me lose my breath Bring the make me lose my breath Hit me make me lose my breath If you can't make me say Like the beat of this Why you for You ain't want If you can't make me say Like the beat of this groove You don't have no business in this your baby You are Come on Breathe me Come go Can you keep Baby make me lose my breath Bring the make me lose my breath Hit me make me lose my Can you keep Baby make me lose my breath Bring the make me lose my breath Hit me make me lose my breath Can you keep Baby make me lose my breath Bring the make me lose my breath Hit me make me lose my Can you keep Baby make me lose my breath Bring the make me lose my breath Hit me make me lose my breath
841,2005,Wonderful Oh oh If it wasn't for the and movie and And all these got I hey Would you still want Would you still be You be oh keep you with no dough ain't trust I know When and go together Like chinchilla and bad weather good but been All my and glamorous a few a crib with a east and west wing this is how and women know the Of how to get it and keep it How to prey on my the power of Got a it ain't just I keep cash and on my life If it wasn't for the money and the I got she wouldn't like me But I keep her and and quite icy Sip who doesn't like And the murderous If it wasn't for the and movie and And all these got I hey Would you still want Would you still be You be oh How many it take to get to Mack that get boy half rich we hit show biz But show biz brought next level Pull up in them hot go and buy the whole I came from the what you want me to at the top of the world and a pussy buffet And why I get Shut the game down so the can't play Hell I splurge money Hell I act funny Look at you All the I been through a wonder why still here Said I was gone but still here And all you that left me here mighty strange how you right back here If it wasn't for the and movie and And all these got I hey Would you still want Would you still be You be oh I wonder why love is about money And why you take it all from honey My life is dark but ain't that don't know Money ain't a need a to the but live in a fortress New new New new the infamous notorious Rule couldn't walk a mile in my don't possess the heart that I do And a wonder that still here Thought I was gone but still here And all you that left me here funny how you right back there If it wasn't for the and movie and And all these got I hey Would you still want Would you still be You be oh
842,2005,Go Yeah a lot of in the club tonight But be Cause me and my clique we don't give a Trick Big If you want it you can get let me know bout to a up If you want it you can get it let me know bout to a up If you want some come get some Cause where from we tote big And everybody know somebody That know somebody that know it And I want now when and a lot of like to act a fool And on get all loud but that ain't my style Now who he And what he Run up on me if he want to Out there his But he stood up in front of his I mop up the with him And I kick in the door and let the hit him I got that'll go get him This for his crew and the that run with him If you want it you can get let me know bout to a up If you want it you can get it let me know bout to a up spit it for the and the and the That be up the and the and the Got me at you bogus in the While they rush the psycho from with the that'll crush We already been for drama If a try to get into but what we still get him fury from my tough that can't never be cute and no penicillin you Trick steal Got me and in the club And my for Don't get it with that You be of and my city a If you want it you can get let me know bout to a up If you want it you can get it let me know bout to a up I ain't that And I that actor soft ain't in my script a you just a square once that into me The whole industry is my enemy If you ain't no kin to me or friend to me Don't to be for the part of the and straight out the hood is ghetto And I don't even need the for you straight out the county of Never gone south of the border most you get If you want it you can get let me know bout to a up If you want it you can get it let me know bout to a up If you want it you can get let me know bout to a up If you want it you can get it let me know bout to a up The go The go The go The go
843,2005,Just Lose It down down down okay Guess back again tell a friend Now everyone to the dance floor To the dance to the dance floor Now everyone to the dance floor time Come little on my lap Guess back with a brand new And I don't mean as in a new case Of child no got a brand new bag of What else could I do to make I done on everything but little And not a stab at just a just psycho I go a little bit crazy I get a little bit out of control with my Good do a little slide Bend touch your and just glide Up the of the dance floor Like for my And cool if you let one go who'd hear Give a little okay my just And everyone just heard you let one rip Now make you dance your shake that ass I mean girl you know you're my world now lose it Just lose it Go crazy baby baby and my day Just to party all the way Maybe I don't know what day Every just a holiday on the breezy Let the top down and my hair blow I don't know where all I know is When I get there touch my body I don't mean to sound like a jerk But just a little out from work Could you punch me in the stomach and pull my Spit on Maybe gouge my your your you must be up out your mind beer blind just to now Now make you dance your shake that ass I mean girl you know you're my world now lose it Just lose it Go crazy baby baby and up in and I don't know what They say I was Down the street Your I don't All I know is this not guilty They we got you on at an old lady to touch my body Now this is the part where the rap down It real no one a sound Everything like Mile now The beat back and everybody lose themselves Now snap back to Rabbit you me up to a grown man I don't have any to go right so Grab your left make your right one jealous Black white skinny fat Tall small all Everyone to the dance floor your chance for a little romance or Butt the season Just go so Now make you dance your shake that ass I mean girl you know you're my world now lose it Just lose it Go crazy baby baby Touch my body Touch my body Oh just touch my body I mean just touch my
844,2005,Lean Back My Throw your in the air right Feel this right Yeah I see you Born Lord I don't give a about your or we from the New love to spark the place Half the in the Squad got a scar on their face a cold world and this is ice Half a for the this is life Got the Phantom in front of the Trinity Ten been they still figure me bad As a was too much to cope with Why you me Cook Coke been Robbery or maybe Grand Larceny I did it I put the to the puzzle Just as I knew me and my was bubble Came out the gate on some Fat with the was the kid I said my don't dance We just pull up our do the rockaway Now lean lean back Lean lean back I said my don't dance We just pull up our do the rockaway Now lean lean back Lean lean back R to the M to the My stay the Don stay Got a date at in the And I just bought a bike so I can ride I die With a to cop me a mansion My in the but you know they not We and don't we boogie So never mind how we got in here with and we don't pay admission and the don't check us And we walk around the metal And there ain't a need for a section In the middle of the dance floor check it Said my Now what the I call a chain money ain't a we still the same just now we to change the I said my don't dance We just pull up our do the rockaway Now lean lean back Lean lean back I said my don't dance We just pull up our do the rockaway Now lean lean back Lean lean back Now we sweater now And that can fly through any weather now get tight when you worth some This is why I sport the to hurt they You can find Crack at all type of Out in front row to all the and If boy come then they'd squeal Cause half these they blow like If you cross the damn right hurt you These even made gang commercial Even Bow Wow it up keep me to speak about the of I don't speak about the Not even Pee Wee could imagine this My didn't have to play to win the I said my don't dance We just pull up our do the rockaway Now lean lean back Lean lean back I said my don't dance We just pull up our do the rockaway Now lean lean back Lean lean back
