,decade,text
932,2003,Die Another Day wake and no kiss some part of keep this secret close my body now I die another day I die another day I die another day I die another day I guess die another day I guess die another day I guess die another day I guess die another day this this this break the cycle shake up the system destroy my ego close my body now I think find another way so much more to know I guess die another day not my time to go For every have to pay A time to a time to play I think find another way not my time to go avoid the suspend my delay my pleasure close my body now I die another day I guess die another day I die another day I guess die another day I think find another way so much more to know I guess die another day not my time to go I need to lay down I die another day I guess die another day I die another day I guess die another day Another day Another day Another day Another day Another day Another day Another
933,2003,A Moment Like This What if I told you it was all meant to Would you believe Would you almost that that we've met before So tell me that you don't think crazy When I tell you love has come here and now A moment like this Some people wait a lifetime for a moment like this Some people search forever for that one special kiss I can't believe to me Some people wait a lifetime for a moment like this Everything but beauty Something so I can't explain I may be but I awake Can we make this dream last And cherish all the love we share A moment like this Some people wait a lifetime for a moment like this Some people search forever for that one special kiss I can't believe to me Some people wait a lifetime for a moment like this Could this be the love of I know that you will catch me when I fall So let me tell you this Some people wait a lifetime for a Like this Some people wait a lifetime for a moment like this Some people search forever for that one special kiss I can't believe to me Some people wait a lifetime for a moment like this like this I can't believe to me Some people wait a lifetime for a moment like this like
934,2003,One Last Breath Please come now I think on to all I think is safe It I found the road to nowhere And to escape I back when I heard thunder But down to one last breath And with it let me say Let me say Hold me now six feet from the edge And maybe six feet Ain't so far down down now that over on all of my I thought I found the road to somewhere Somewhere in His grace I save But down to one last breath And with it let me say Let me say Hold me now six feet from the edge And maybe six feet Ain't so far down Hold me now six feet from the edge And maybe six feet Ain't so far down so far down Sad follow me But I still believe Something left for me So please come stay with me I still believe Something left for you and me For you and me For you and me Hold me now six feet from the edge And Hold me now six feet from the edge And maybe six feet Ain't so far down Hold me now six feet from the edge And maybe six feet Ain't so far down Please come now I think on to all I think is
935,2003,the Light the yeah yeah the the don't say it the the light and pass the Buss a in ah me sight and I to know Which one is catch my flow Cause the And I got my dough Buss a And I to know Could I be your Your buff in every sector Everyman around turn your inspector But you no let them sweat no grill you with no lecture But power drill or fuel a collector of a like wan come wreck Done out the part where you got your But you know you let them guy affect the light and pass the Buss a in ah me sight and I to know Which one is catch my flow Cause the And I got my dough Buss a And I to know five of them live again Girl hang out with The and the Beside of them and say of the and Will never get inside of the money girl bout A try make bride of again Some a a move like a say Open wide again the light and pass the Buss a in ah me sight and I to know Which one is catch my flow Cause the And I got my dough Buss a And I to know Could I be your Your buff in every sector Everyman around turn your inspector But you no let them sweat no grill you with no lecture But power drill or fuel a collector of a like wan come wreck Done out the part where you got your But you know you let them guy affect the light and pass the Buss a mi sight and I to know Which one is catch my flow Cause the And I got my dough Buss a And I to know five of them live again Girl hang out with The and the Beside of them and say of the and Will never get inside of the money girl bout A try make bride of again Some a a move like a say Open wide again the light and pass the Buss a mi sight and I to know Which one is catch my flow Cause the And I got my dough Buss a And I to
936,2003,Dilemma I love you And I need you I love you I do need you No what I do All I think about is you Even when with my boo you know crazy over you No what I do All I think about is you Even when with my boo You know crazy over you I met this chick and she just right up the block from me And she got the for me The thing my hood done seen But oh oh no She got a man and a son though But okay I Wait for my cue and just play my position Like a pick up And in no I plan to make this one here mine And for sure I I never been the type to break up a happy but baby girl I just can't leave alone So tell it She don't know what you mean to No what I do All I think about is you Even when with my boo you know crazy over you No what I do All I think about is you Even when with my boo You know crazy over you I see a and you and I never say a word I know how start out here about they And no way fight over no dame As you can but I I like your your your whole The way you come through and And swoop me in his Now And I got special to thank Don't you forget it But it ain't that easy for you to pack up and leave him But you and dirty got for different I respect and right before I turn to leave She don't know what you mean to No what I do All I think about is you Even when with my boo you know crazy over you No what I do All I think about is you Even when with my boo You know crazy over you Sing it for And I love you and I need you I love I do And more than you'll know for sure You can always count on my love yeah East I know you right Down I know you right West I know you right You don't know what you mean to me I see you right No what I do All I think about is you Even when with my boo you know crazy over you No what I do All I think about is you Even when with my boo You know crazy over you East I know you right Down I know you right West I know you You don't know what you mean to me I see you right East you still right Down I see you right West I know you You don't know what you mean to me I see you right No what I do All I think about is you Even when with my boo you know crazy over you No what I do All I think about is you Even when with my boo you know crazy over you No what I do All I think about is you Even when with my boo you know crazy over you East I know you right Down I know you right West I know you You don't know what you mean to me I see you right East you still right Down I see you right West I know you You don't know what you mean to me I see you
937,2003,U This is for my one This is for my one This is for my one True baby for I adore This is hard to say I make sure I go about this in the right way I been busy a lot And I know you feel and what not I to tell you that hair fly Kiss you slow and stare in your Now I talk real foul and slick Every other sentence make me Back in the I was your one pick Now your and hard to fix I had to dig deep inside myself I can't see you with somebody else a long journey back to the place we was When I was too to admit I was in love And you was my good girl that wouldn't give it up I can't let us Baby smile today I been more U When your see you too Just when you think else I can do U When I think about the we did And I think about you my And I think about us a crib all God forbid You deserve and the simple In addition to the and Instead I walk around like a king And you nothing but a thing I even you the was good Too busy in the hood Baby hold me tight let go do it real gentle nice and slow One more chance baby and say no I got another side to show Some say love is painful it you grow Well time for the pain to Baby smile today I been more U When your see you too Just when you think else I can do U Do you think I meant to hurt No Do you think I meant to hurt No So laugh cry together God we die together Do you think I meant to hurt No Do you think I meant to hurt No So laugh cry together God we die together a brand new a brand new you A brand new sky so blue Hold my hand while I walk with you Sit on my talk to you No more you foul like is all the same love you my From this day forward never be the same rub your share my I love show you what I mean Give you the love a girl seen Watch you so peaceful and serene A toast to the back in my life But this time do it right Trust from the bottom of my heart tear us promise Baby smile today I been more U When your see you too Just when you think else I can do U Baby smile today I been more U When your see you too Just when you think else I can do U Do you think I meant to hurt No Do you think I meant to hurt No So laugh cry together God we die together Do you think I meant to hurt No Do you think I meant to hurt No So laugh cry together God we die together This is for my one This is for my one True baby for I
938,2003,Hey Ma come on Hey Hey ma slide and we get it on tonight You I drink Well we get high tonight Got got we take a ride tonight So ma slide and we get it on tonight now I was downtown night Seen she was And I approach baby your age and She at me and a I told eighteen and live a crazy life Plus tell you what the like And I know what the like Need a man and advice I could be all plus I can lay the pipe Come with come stay the night She at me your game is back you're get in the car And don't touch sit in the car discuss either we or see you tomorrow Now we up the West Side Hand up her left ready to do it Ready to ready for dome already we home Now get it on Hey ma slide and we get it on tonight You I drink Well we get high tonight Got got and we take a ride tonight So ma slide and we get it on tonight Now that I got a my ex and spit Told me to acknowledge her quick She stop on that swallow and is I promise you have a problem with They all say rotten and rich But not high heel feel Plus got them huh You a still And this my down girl ain't no deal We left the with To the I tell my boo real I mean she do be Go to the she got the linen I see boo be She and I know that you be a look at the I got a whole new game plan and nothing but She was she was up in the man her off at the now the cell I had to call up L L I Plus and we got it on tonight Hey ma slide and we get it on tonight You I drink Well we get high tonight Got got and we take a ride tonight So ma slide and we get it on
939,2002,like this the way it is like this the way it is Chill Lay all been done before And if you could only Let it you would see I like you the way you are When we're in your car And you're to me but you become Somebody else round everyone else You're your back like you can't You're be you look like a fool To tell me you have to go and make so I see the way you're like you're somebody me like you And you and you and you break And you take what you get and you turn it into Honesty and promise never find you Fake no You come over up like you're else Where you are and where at You you're me Laugh out when you strike your pose Take off all your You you're not Anyone when you become Somebody else round everyone else You're your back like you can't You're be you look like a fool To tell me you have to go and make so I see the way you're like you're somebody me like you And you and you and you break And you take what you get and you turn it into Honesty and promise never find you Fake it no No No No no no Chill Lay all been done before And if you could only let it you will see Somebody else everyone else You're your back like you can't You're to be cool You look like a fool to me Tell me you have to go and make so I see the way you're like you're somebody me like you And you and you and you break And you take what you get And you turn it into honesty And promise never find you fake it no you have to go and make so I see the way you're like you're somebody me like you And you and you and you break And you take what you get And you turn it into honesty And promise never find you fake it
940,2002,Out My Closet my I have no snare in my There you go Yeah Have you been or I I been and against Picket for my look at the Sick is the mind of the kid behind All this run deep as from just blow off and keep Not from no give hell long as Keep ass in the and in the Leave with a taste as sour as vinegar in they mouth they can but they'll never figure me out Look at me I bet you're sick of me now Ain't make you look so ridiculous I never meant to hurt you I never meant to make you cry But tonight out my closet I said I never meant to hurt you I never meant to make you cry But tonight out my closet I got some in my closet and I don't know if no one it So before they throw me inside my coffin and close it expose take you back to Before I had a I was a maybe I was just a couple of My father had his up in a bunch he I wonder if he even me goodbye I on second I just he would die I look at and I couldn't picture her side Even if I grit my teeth and try To make it work with her at least for I maybe made some But only but man enough to face today What I did was no doubt it was dumb But the I did was take the out of that gun I shot and him both my like to welcome to The Show I never meant to hurt you I never meant to make you cry But tonight out my closet I said I never meant to hurt you I never meant to make you cry But tonight out my closet I would never my own just to get Take a second to listen you think this is But put yourself in my just try to your prescription in the kitchen that always through her purse and through public victim of Syndrome My whole life I was made to believe I was sick when I wasn't I grew now I blew it you sick to your doesn't Wasn't it the reason you made that for So you could try to justify the way you But guess you're and cold when you're And up so know that you're phony And so big you should see beautiful But you'll never see she won't even be at your funeral what me the most is you won't admit you was wrong do your keep yourself that you was a But how dare you try to take what you didn't help me to You selfish I hope you burn in hell for this when and you said you it was guess I am to you as can I never meant to hurt you I never meant to make you cry But tonight out my closet I said I never meant to hurt you I never meant to make you cry But tonight out my
941,2002,I just rock all night long I just rock you all night long Need you to I ain't your average Baby it well I ain't lead you just ask If you might give me your explain your status You know I see you in time and you seem Don't mean I know these settle you say you on my short list of few Them other is but you Want you in the best what you do about Why don't you just test you won't want to do without it at you a thug And I ain't up till I get that I just rock all night long I just rock all night long I know you seen me this that always my tight Hair fit just right with a tan Walk all here I am Ain't a shame in my frame and I know you're on a show for and I ain't Lot of in your you do Only thing to make it though is me with you And I know you that of your And I heard through the it was me you Let me find you shy or But I know you're not So stop the and is you real or I just rock all night long I just rock all night long now in place Shouldn't of took you so long in the first place just give me a call you ain't got to see me to my car a big girl but you'll find out Stop for me while I drop top and ride out know what all But these out my mouth that just got me that that just got me I just rock all night long I just rock all night long I rock I hold baby Won't you be my I be your lady I rock I hold baby Won't you be my I be your lady let me rock with you You know I rock with you Baby let me rock with you You know I rock with you let me rock with you You know I rock with you Baby let me rock with you You know I rock with you you know I rock with you let me rock with
942,2002,Heaven you're all that I want When you're lying here in my it hard to believe We're in Heaven We're in Heaven about our There was only you and me We were young and wild and free Now nothing can take you away from me We've been down that road before But over now You keep me back for more you're all that I want When you're lying here in my it hard to believe We're in Heaven And love is all that I need And I found it there in your heart It isn't too hard to see We're in Heaven nothing could change what you mean to oh a lot that I could say But just hold me now our love will light the way you're all that I want When you're lying here in my it hard to believe We're in Heaven And love is all that I need And I found it there in your heart It isn't too hard to see We're in Heaven Now our are true Through the good and the bad be there by you Love is all that I need And I found it there in your heart It isn't too hard to see We're in Heaven oh oh We're in
943,2002,Just Like a Pill here on the floor where you left me I think I took too much what have you I thought it would be fun I can't stay on your life support a shortage in the switch I can't stay on your morphine me itch I said I to call the nurse again But a little bitch I think get here Where I can just as fast as I can To the middle of nowhere To the middle of my And I you're just like a pill Instead of me You keep me ill You keep me ill I haven't from the spot where you left me This must be a bad trip All of the other They were different Maybe I should get some help I can't stay on your life support a shortage in the switch I can't stay on your morphine me itch I said I to call the nurse again But a little bitch I think get here Where I can just as fast as I can To the middle of nowhere To the middle of my And I you're just like a pill Instead of me You keep me ill You keep me ill Run just as fast as I can To the middle of nowhere To the middle of my And I you're just like a pill Instead of me You keep me ill You keep me ill I can't stay on your life support a shortage in the switch I can't stay on your morphine me itch I said I to call the nurse again But a little bitch I think get here Where I can just as fast as I can To the middle of nowhere To the middle of my And I you're just like a pill Instead of me You keep me ill You keep Run just as fast as I can To the middle of nowhere To the middle of my And I you're just like a pill Instead of me You keep me ill You keep Run just as fast as I can To the middle of nowhere To the middle of my And I you're just like a pill Instead of me You keep me ill You keep me ill Run just as fast as I can To the middle of nowhere To the middle of my And I
944,2002,Long Time Gone Daddy on a front porch out on a vacant field to be with burley Now he it never will My found work in a nurse at the old home still too much for And me been a long time gone Been a long time gone I ain't a row since I don't know when Long time gone And it ain't back again that church out on her farm She always thought that we'd be together Lord I never meant to do her harm Said she could hear me in the choir I heard another song I caught wind and hit the road And been a long time gone Been a long time gone I ain't had a since I don't know when Long time gone And it ain't back again Now I went to to beat the big deal down on there the hard way from a tip jar in my car my guitar Yeah be a star me and every the children and the garden grow We listen to the radio to hear But the music ain't got no soul Now they sound but they don't sound Haggard They've got money but they don't have Cash They got Junior but they don't have Hank I I I think The rest is a long time gone I ain't hit the roof since I know when Long time gone And it ain't back I said a long time gone I ain't the horn since I know when Long time gone And it ain't back again I said a long long long time gone Well been a long time Long long long time gone been a long time gone Long long long time gone Yeah
945,2002,Hot in hot so hot in here So hot Want a little bit of and a little bit of Just a little bit just a little bit of Just a little bit just a little bit of I was good ass is show for the right time to shoot my for the right time to flash them please believe in Me and the rest of my Check got it at the top of the No up my sleeve and No I need you to Get up on the dance floor Give that man what he for I feel like loose And I feel like And can't nobody stop the juice So tell the I said hot in here So take off all your I am so hot I take my off hot in here So take off all your I am so hot I take my off Why you at the bar if you ain't the What good is all the fame if you ain't the I see you ain't the throttle And be down to do a top down and Got off the exit and it Ash flip time to spark it Went collar for got out and it I spit game I can't talk it Warm hot up in this joint tank top on at this point You a you can't lose I got can't leave So take it off like you're home alone You dance in front your mirror while you're on the phone your and your best friend I think my butt hot in here So take off all your I am so hot I take my off hot in here So take off all your I am so hot I take my off Mix a little bit of with a little bit of Let it just fall out Give a little bit of with a little bit of Let it hang all out With a little bit of and a sprinkle of that Let it just fall out I like it when baby make it Oh Stop time I got a friend with a pole in the just like you do it extra spread the took a trip from the to the Came back with than in Say she got a thing about in hot in here So take off all your I am so hot I take my off hot in here So take off all your I am so hot I take my off hot in here So take off all your I am so hot I take my off hot in here So take off all your I am so hot I take my off Mix a little bit of with a little bit of Let it just fall out Give a little bit of with a little bit of Let it hang all out With a little bit of and a sprinkle of that Let it just fall out I like it when baby make it
946,2002,Just a Friend You ready for I know your name and I know if you man I know everything I know your and if I can come over and I know what you like I know so I can do it all night But you're me just a friend You're me just a friend Oh baby you Got what I need But you say just a friend But you say just a friend I can be your fantasy But you say just a friend But you say just a friend I know you in and out I know what you're all about I know what you laugh I know about your past I know how you move I know so I can move too But you're me just a friend me just a friend Oh baby you Got what I need But you say just a friend But you say just a friend I can be your fantasy But you say just a friend But you say just a friend Oh you Got what I need But you say just a friend But you say just a friend I can be your fantasy But you say just a friend But you say just a friend can you give me one reason why You wouldn't want this I stay I stay And I you know fly stop with me And get it on tonight You got nothing to lose Let me do what I do Oh baby Got what I need But you say just a friend But you say just a friend I can be your fantasy But you say just a friend But you say just a friend Oh you Got what I need But you say just a friend But you say just a friend I can be your fantasy But you say just a friend But you say just a friend You can call me you like It doesn't day or night We can do whatever you up to you Don't fight the that you feel I can tell that real So won't you help me Why you say just a friend Oh you Got what I need But you say just a friend But you say just a friend I can be your fantasy But you say just a friend But you say just a friend
947,2002,Hero I am so I can hear heaven I am so I can hear heaven but heaven don't hear me And they say that a hero could save us not stand here and wait hold on to the of the Watch as we all fly away Someone told me love would all save us But how can that Look what love gave us A world full of and blood That world never came And they say that a hero could save us not stand here and wait hold on to the of the Watch as we all fly away Now that the world isn't love that to you It isn't the love of a hero And why I fear it won't do And they say that a hero could save us not stand here and wait hold on to the of the Watch as we all fly away And they're us They're us As we all fly away And they're us They're us As we all fly away And they're us They're us As we all fly away
